{
  "assignment_ledger": [
    {
      "arm": "treatment",
      "cell_id": "rp-03-review-record-binding::treatment",
      "execution_order": 1,
      "fixture_id": "rp-03-review-record-binding"
    },
    {
      "arm": "control",
      "cell_id": "or-03-coordinator-event-sequence::control",
      "execution_order": 2,
      "fixture_id": "or-03-coordinator-event-sequence"
    },
    {
      "arm": "control",
      "cell_id": "dx-03-doctor-remediation::control",
      "execution_order": 3,
      "fixture_id": "dx-03-doctor-remediation"
    },
    {
      "arm": "treatment",
      "cell_id": "cs-02-campaign-effort::treatment",
      "execution_order": 4,
      "fixture_id": "cs-02-campaign-effort"
    },
    {
      "arm": "treatment",
      "cell_id": "or-03-coordinator-event-sequence::treatment",
      "execution_order": 5,
      "fixture_id": "or-03-coordinator-event-sequence"
    },
    {
      "arm": "treatment",
      "cell_id": "dx-03-doctor-remediation::treatment",
      "execution_order": 6,
      "fixture_id": "dx-03-doctor-remediation"
    },
    {
      "arm": "control",
      "cell_id": "cs-02-campaign-effort::control",
      "execution_order": 7,
      "fixture_id": "cs-02-campaign-effort"
    },
    {
      "arm": "control",
      "cell_id": "or-02-handoff-output-uniqueness::control",
      "execution_order": 8,
      "fixture_id": "or-02-handoff-output-uniqueness"
    },
    {
      "arm": "control",
      "cell_id": "dx-01-validation-json::control",
      "execution_order": 9,
      "fixture_id": "dx-01-validation-json"
    },
    {
      "arm": "treatment",
      "cell_id": "or-01-scheduler-capacity::treatment",
      "execution_order": 10,
      "fixture_id": "or-01-scheduler-capacity"
    },
    {
      "arm": "control",
      "cell_id": "cs-01-experiment-metadata::control",
      "execution_order": 11,
      "fixture_id": "cs-01-experiment-metadata"
    },
    {
      "arm": "control",
      "cell_id": "or-01-scheduler-capacity::control",
      "execution_order": 12,
      "fixture_id": "or-01-scheduler-capacity"
    },
    {
      "arm": "treatment",
      "cell_id": "dx-02-campaign-explain::treatment",
      "execution_order": 13,
      "fixture_id": "dx-02-campaign-explain"
    },
    {
      "arm": "control",
      "cell_id": "rp-01-lineage-disconnected::control",
      "execution_order": 14,
      "fixture_id": "rp-01-lineage-disconnected"
    },
    {
      "arm": "treatment",
      "cell_id": "rp-01-lineage-disconnected::treatment",
      "execution_order": 15,
      "fixture_id": "rp-01-lineage-disconnected"
    },
    {
      "arm": "control",
      "cell_id": "rp-03-review-record-binding::control",
      "execution_order": 16,
      "fixture_id": "rp-03-review-record-binding"
    },
    {
      "arm": "treatment",
      "cell_id": "rp-02-environment-size-cap::treatment",
      "execution_order": 17,
      "fixture_id": "rp-02-environment-size-cap"
    },
    {
      "arm": "treatment",
      "cell_id": "or-02-handoff-output-uniqueness::treatment",
      "execution_order": 18,
      "fixture_id": "or-02-handoff-output-uniqueness"
    },
    {
      "arm": "treatment",
      "cell_id": "dx-01-validation-json::treatment",
      "execution_order": 19,
      "fixture_id": "dx-01-validation-json"
    },
    {
      "arm": "treatment",
      "cell_id": "cs-01-experiment-metadata::treatment",
      "execution_order": 20,
      "fixture_id": "cs-01-experiment-metadata"
    },
    {
      "arm": "control",
      "cell_id": "cs-03-run-stop-reason::control",
      "execution_order": 21,
      "fixture_id": "cs-03-run-stop-reason"
    },
    {
      "arm": "control",
      "cell_id": "dx-02-campaign-explain::control",
      "execution_order": 22,
      "fixture_id": "dx-02-campaign-explain"
    },
    {
      "arm": "control",
      "cell_id": "rp-02-environment-size-cap::control",
      "execution_order": 23,
      "fixture_id": "rp-02-environment-size-cap"
    },
    {
      "arm": "treatment",
      "cell_id": "cs-03-run-stop-reason::treatment",
      "execution_order": 24,
      "fixture_id": "cs-03-run-stop-reason"
    }
  ],
  "authority": "none-this-artifact-is-not-authorization",
  "baseline_materials": [
    {
      "files": [
        {
          "path": "experiments/self-bootstrap-effectiveness-v2/templates/baseline-v2.yaml",
          "sha256": "e93a106a431597b673631f3a57254816d1df5dd47f68d18c61a68838aba526d2"
        }
      ],
      "path": "experiments/self-bootstrap-effectiveness-v2/templates/baseline-v2.yaml",
      "tree_sha256": "ecc9d340c76c2255c4386a8e824b611725cffc35691f7da9865ebbccde78b15e"
    }
  ],
  "cohort_id": "self-bootstrap-effectiveness-v2",
  "dispatch_allowed": false,
  "fixture_count": 12,
  "fixtures": [
    {
      "files": [
        {
          "path": "experiments/self-bootstrap-effectiveness-v2/fixtures/cs-01-experiment-metadata/prompt.txt",
          "sha256": "456ea42fb2a974a4e8f09aca6acb6844b710d9d0e2fecd5d0b0b3a9a90e93a7f"
        }
      ],
      "fixture_id": "cs-01-experiment-metadata",
      "tree_sha256": "de9f64ca87c31ca73bc92c322d1ea86891395adce87703366a8cafd3d94c58b3"
    },
    {
      "files": [
        {
          "path": "experiments/self-bootstrap-effectiveness-v2/fixtures/cs-02-campaign-effort/prompt.txt",
          "sha256": "9d1255dec03fd82e17e474798065892cc1209581976425a02a06f161c6082960"
        }
      ],
      "fixture_id": "cs-02-campaign-effort",
      "tree_sha256": "5fa9e15d61a7e6b08a3dfb4c4455f4b81b06dc3152e75d16db587771b67c675a"
    },
    {
      "files": [
        {
          "path": "experiments/self-bootstrap-effectiveness-v2/fixtures/cs-03-run-stop-reason/prompt.txt",
          "sha256": "b354c65e7d66bf194cf3cbe5218761ef91122c4b72ffd593e6143de39868e12b"
        }
      ],
      "fixture_id": "cs-03-run-stop-reason",
      "tree_sha256": "c7c76791fa4eecd94731d5278cf09f9ff0f6cd9e21c44b17b18713fd60782fc9"
    },
    {
      "files": [
        {
          "path": "experiments/self-bootstrap-effectiveness-v2/fixtures/dx-01-validation-json/prompt.txt",
          "sha256": "f8e7cd758011c13de93ceefba015ad151744a37748affe668f14423aa8c6fa53"
        }
      ],
      "fixture_id": "dx-01-validation-json",
      "tree_sha256": "0d6ade4df1d44beb2039aba26b64edb3db4d1b1c1a82ef84fb3979447ecf343c"
    },
    {
      "files": [
        {
          "path": "experiments/self-bootstrap-effectiveness-v2/fixtures/dx-02-campaign-explain/prompt.txt",
          "sha256": "c0aefb7f3764f0b199071f470303393105d0b94c14f34f88765d3e8e77fd2fe0"
        }
      ],
      "fixture_id": "dx-02-campaign-explain",
      "tree_sha256": "0f3c7d3a21239a061c6da8dbfc2ff7bc7018bef8018297a62226e07a3fcef6a2"
    },
    {
      "files": [
        {
          "path": "experiments/self-bootstrap-effectiveness-v2/fixtures/dx-03-doctor-remediation/prompt.txt",
          "sha256": "ee105190b21f11e1a5f2b0aea2422359dc18c62dcf6545bdcdf04de94e2877e9"
        }
      ],
      "fixture_id": "dx-03-doctor-remediation",
      "tree_sha256": "a4050f92be8de85bd182c50d422dbdb34dac638916efdcfe70cc1b77e6c6c985"
    },
    {
      "files": [
        {
          "path": "experiments/self-bootstrap-effectiveness-v2/fixtures/or-01-scheduler-capacity/prompt.txt",
          "sha256": "cfcc94d649b36f4887054436516d01e369c6fb825137e6827eef646af314e552"
        }
      ],
      "fixture_id": "or-01-scheduler-capacity",
      "tree_sha256": "0fd60da79473321dac8594fc150a0b8f64cc6d02280d1d8e6832eb3b7df89104"
    },
    {
      "files": [
        {
          "path": "experiments/self-bootstrap-effectiveness-v2/fixtures/or-02-handoff-output-uniqueness/prompt.txt",
          "sha256": "f423779b64e5537faff42eb8f594da72167eeb32fab93692ec00ddfb5b67fb3d"
        }
      ],
      "fixture_id": "or-02-handoff-output-uniqueness",
      "tree_sha256": "f7ddd4d90d82475b5d7d2557f57906b424aba3e828fd8cd177d06b51507068f3"
    },
    {
      "files": [
        {
          "path": "experiments/self-bootstrap-effectiveness-v2/fixtures/or-03-coordinator-event-sequence/prompt.txt",
          "sha256": "7f3af0254be039f1a4fd93f7abaaf6ff40dfc1d5296a50198e4cbb37adbe36a0"
        }
      ],
      "fixture_id": "or-03-coordinator-event-sequence",
      "tree_sha256": "9bf075f1a8b5dc1c9e96fcd25d0ed805cfcc1fffaf00fb54df9cf1eb9330a379"
    },
    {
      "files": [
        {
          "path": "experiments/self-bootstrap-effectiveness-v2/fixtures/rp-01-lineage-disconnected/prompt.txt",
          "sha256": "9ebeccf5958ceae5ab621364934162009ca269900edcb3415936f7c958cc0abf"
        }
      ],
      "fixture_id": "rp-01-lineage-disconnected",
      "tree_sha256": "1e8d4ff2e59b653a0d7d8b7a24337f5a3083669d54840d8b29a1c0df4f7288bd"
    },
    {
      "files": [
        {
          "path": "experiments/self-bootstrap-effectiveness-v2/fixtures/rp-02-environment-size-cap/prompt.txt",
          "sha256": "4ebf7ef3db50e90464c76eb165641ab74a5599563094beedd430e43cfeccefc8"
        }
      ],
      "fixture_id": "rp-02-environment-size-cap",
      "tree_sha256": "4db088cee96e8d31089d3d14df1790c26e2385c3caa8b0f276fcf49f9abc074b"
    },
    {
      "files": [
        {
          "path": "experiments/self-bootstrap-effectiveness-v2/fixtures/rp-03-review-record-binding/prompt.txt",
          "sha256": "e0da3011d9c7883e207a7b2ddc814ad82d1dadea053900766618eb52ad49fc94"
        }
      ],
      "fixture_id": "rp-03-review-record-binding",
      "tree_sha256": "96085aadbc14394cbd9c5ed134ac037527238aae2d9edd6b99846d8273c1dc74"
    }
  ],
  "freeze_sha256": "d4244d161de5765e6aa79212e35fd04d90be1868c3151cbab20c7987a985a7de",
  "observations": "none-recorded",
  "randomization": {
    "arms": [
      "control",
      "treatment"
    ],
    "method": "sha256-ranked-cells-v1",
    "seed_sha256": "b9b591b3fe43f7c430c2b7b4bd5b7b357e2a23e163e0d79530853bbfc62223ea"
  },
  "registration_materials": [
    {
      "files": [
        {
          "path": "campaigns/self-bootstrap-cohort-v2/reviews/baseline-negative/audit.json",